movie,platform,review_text,date,year,rating,clean_text
La La Land,letterboxd,this cured my depression and brought it back full force in the span of 2 hours,14 Jan 2017,2017,★★★★★,this cured my depression and brought it back full force in the span of 2 hours
La La Land,letterboxd,Love this movie more than I love myself,24 Jun 2017,2017,★★★★½,love this movie more than i love myself
La La Land,letterboxd,I've taken all of your criticisms into account and have determined that you're all wrong.,15 Jan 2017,2017,★★★★★,ive taken all of your criticisms into account and have determined that youre all wrong
La La Land,letterboxd,la la land makes me want to be alive for one hour and fifty minutes then sebastian says welcome to seb's and it makes me want to be dead,01 Feb 2020,2020,★★★★★,la la land makes me want to be alive for one hour and fifty minutes then sebastian says welcome to sebs and it makes me want to be dead
La La Land,letterboxd,the whole ‘what could've been’ sequence continues to be the reason for my death.,28 Jan 2023,2023,★★★★★,the whole what couldve been sequence continues to be the reason for my death
La La Land,letterboxd,It’s insane how there’s still haters of this movie bruh like imma put you in a saw trap,03 Aug 2023,2023,★★★★★,its insane how theres still haters of this movie bruh like imma put you in a saw trap
La La Land,letterboxd,no YOU live in a society i live in la la land,22 Oct 2019,2019,★★★★★,no you live in a society i live in la la land
La La Land,letterboxd,"amy: you can just tell us a story :)mia: about?amy: you can just tell us anything :)mia:amy: whenever you're ready :)mia: ................... my aunt used to live in paris. I remember, she used to come home and she would tell us these stories about being abroad. and I remember, she told us that she jumped into the river once. barefoot. she smiled... leapt without looking .... aNd tumbled into... the seine.... the water was freezing....…more",19 May 2018,2018,★★★★★,amy you can just tell us a story mia aboutamy you can just tell us anything miaamy whenever youre ready mia my aunt used to live in paris i remember she used to come home and she would tell us these stories about being abroad and i remember she told us that she jumped into the river once barefoot she smiled leapt without looking and tumbled into the seine the water was freezingmore
La La Land,letterboxd,THEY BELIEVED IN EACH OTHER SO MUCH!!!!!!!! THEY WERE SO IN LOVE!!!!!!!!!!! I'M A FUCKING WRECK!!!!!!!!!!!!,28 Jan 2017,2017,★★★★★,they believed in each other so much they were so in love im a fucking wreck
La La Land,letterboxd,this movie is like a double-edged sword because a) it makes me really fucking happy b) it makes me really fucking sad c) it makes me want to stab myself with said sword,05 Apr 2018,2018,★★★★★,this movie is like a doubleedged sword because a it makes me really fucking happy b it makes me really fucking sad c it makes me want to stab myself with said sword
La La Land,letterboxd,･ ｡☆city∴｡　*･ﾟ*of｡★･･ stars｡　　 *･ ﾟ*｡･ﾟare★｡☆ﾟ･｡you°*. ﾟ*　　ﾟ｡·*･｡shining ﾟ*ﾟ *.｡just ☆｡★　･* ☆ ｡･ﾟfor*.｡*　★ ﾟme･｡ * ｡･　　ﾟ☆ ｡Happy La La Land dayyyy!,25 Apr 2018,2018,★★★★★,city　ﾟof stars　　 ﾟﾟareﾟyou ﾟ　　ﾟshining ﾟﾟ just 　 ﾟfor　 ﾟme 　　ﾟ happy la la land dayyyy
La La Land,letterboxd,I enjoy the 2016 Damien Chazelle filmLa La Land.,09 Mar 2020,2020,★★★★★,i enjoy the 2016 damien chazelle filmla la land
La La Land,letterboxd,"I want to take some time to talk about the Epilogue of the film.I've heard many different theories about what the Epilogue truly means. The reality is the idea that true love is being willing to make sacrifices. In this Epilogue, Sebastian was far more willing to make sacrifices for Mia than she was for him. There is a scene earlier on in the film that beautifully foreshadows the entire story. The scene after Sebastian finds Mia's keys and…more",30 Jul 2020,2020,★★★★★,i want to take some time to talk about the epilogue of the filmive heard many different theories about what the epilogue truly means the reality is the idea that true love is being willing to make sacrifices in this epilogue sebastian was far more willing to make sacrifices for mia than she was for him there is a scene earlier on in the film that beautifully foreshadows the entire story the scene after sebastian finds mias keys andmore
La La Land,letterboxd,"the type of movie that makes me wanna drive alone all night long, reminiscing about moments I’ve never lived",23 May 2021,2021,★★★★★,the type of movie that makes me wanna drive alone all night long reminiscing about moments ive never lived
La La Land,letterboxd,why was john legend such a jump-scare,07 Apr 2022,2022,★★★★½,why was john legend such a jumpscare
La La Land,letterboxd,"I cried like a baby, got some loud assholes kicked out of the theater, and accidentally got into the wrong car and scared the shit out of some random lady! BEST NIGHT! I FUCKING LOVE LA LA LAND! BEST MOVIE EVER!",23 Jan 2017,2017,★★★★★,i cried like a baby got some loud assholes kicked out of the theater and accidentally got into the wrong car and scared the shit out of some random lady best night i fucking love la la land best movie ever
La La Land,letterboxd,"""5 years later"" is where I draw the line",22 Jun 2023,2023,★★★★★,5 years later is where i draw the line
La La Land,letterboxd,ryan gosling got that golden globe for being the first person ever to act miserable while playing take on me - aha,17 Apr 2018,2018,★★★½,ryan gosling got that golden globe for being the first person ever to act miserable while playing take on me aha
La La Land,letterboxd,Why does the opening song have the same melody as the crab rave song,04 Mar 2023,2023,★★★★½,why does the opening song have the same melody as the crab rave song
La La Land,letterboxd,I love Ryan GoslingI love Emma StoneI love City of starsI love Another day of sunI love someone in the crowdI love the cinematographyI love the costumesI love the actingI LOVE THIS MOVIE.,05 Jul 2020,2020,★★★★★,i love ryan goslingi love emma stonei love city of starsi love another day of suni love someone in the crowdi love the cinematographyi love the costumesi love the actingi love this movie
La La Land,letterboxd,"i literally have not and will not ever see a movie better than this, we really do not deserve movies this good.",28 Dec 2016,2016,★★★★★,i literally have not and will not ever see a movie better than this we really do not deserve movies this good
La La Land,letterboxd,damien chazelle saw the ‘gotta go my own way’ scene in high school musical 2 and really made a whole movie out of it,26 Feb 2019,2019,★★★★★,damien chazelle saw the gotta go my own way scene in high school musical 2 and really made a whole movie out of it
La La Land,letterboxd,sebastian has set up such unrealistic expectations for men. they should all just give up,31 May 2021,2021,★★★★★,sebastian has set up such unrealistic expectations for men they should all just give up
La La Land,letterboxd,due to personal reasons i will be passing away,18 Feb 2019,2019,★★★★★,due to personal reasons i will be passing away
La La Land,letterboxd,watched this on the flight to LA and it put me in such a good mood im gonna dance down the I-405 and i don't care if some dude in a lamborghini going 500mph fucking annihilates me,22 May 2017,2017,★★★★★,watched this on the flight to la and it put me in such a good mood im gonna dance down the i405 and i dont care if some dude in a lamborghini going 500mph fucking annihilates me
La La Land,letterboxd,that post about how emma stone looks like a bitmoji ruined my fucking life,02 Oct 2017,2017,★★★½,that post about how emma stone looks like a bitmoji ruined my fucking life
La La Land,letterboxd,"Jacques Demy for the digital age... walks the uneasy bridge between romance and reality almost as nimbly as Singin' in the Rain did the one between silent films and talkies.i think this is a more difficult — and more rewarding — film than some people are expecting, or will be interested in seeing. the way it disintegrates from the technicolor to the quotidian, from a romance about movies to a movie about romance... it's a bold move, executed to…more",31 Aug 2016,2016,★★★★½,jacques demy for the digital age walks the uneasy bridge between romance and reality almost as nimbly as singin in the rain did the one between silent films and talkiesi think this is a more difficult and more rewarding film than some people are expecting or will be interested in seeing the way it disintegrates from the technicolor to the quotidian from a romance about movies to a movie about romance its a bold move executed tomore
La La Land,letterboxd,i think i’ve seen this film before and i didn’t like the ending,01 Jan 2021,2021,★★★★½,i think ive seen this film before and i didnt like the ending
La La Land,letterboxd,Insane how this movie can make you both extremely happy and extremely sad,11 Oct 2022,2022,★★★★★,insane how this movie can make you both extremely happy and extremely sad
La La Land,letterboxd,watched again with the hope that the end would magically change,23 Jun 2024,2024,★★★★★,watched again with the hope that the end would magically change
La La Land,letterboxd,"Good news for everyone who hates this film: this is the first time I've watched it that made me go ""hmmm okay parts of this movie are very very corny."" Bad news for those same people: I still think the opening is so beautiful and celebratory and exuberant in a way I want more movies to be, I still think Emma Stone is so fucking fantastic and deserved the Best Actress Oscar, and Damien Chazelle deserved his Best Director Oscar! This movie rules!!!!!!!!",26 Oct 2019,2019,★★★★★,good news for everyone who hates this film this is the first time ive watched it that made me go hmmm okay parts of this movie are very very corny bad news for those same people i still think the opening is so beautiful and celebratory and exuberant in a way i want more movies to be i still think emma stone is so fucking fantastic and deserved the best actress oscar and damien chazelle deserved his best director oscar this movie rules
La La Land,letterboxd,i want emma stone and ryan gosling to tap dance on my face,06 Apr 2019,2019,★★★★★,i want emma stone and ryan gosling to tap dance on my face
La La Land,letterboxd,"i realize i’m such a cliché for saying this, but this movie really is the reason why i’m out here. it’s the reason idoanything. i’ve heard every complaint and critique and i just don’t care - this is the purest form of movie magic i’ve ever experienced and simply one of the most impactful and influential movies i’ve ever seenperiod. it never shies away from how hard it is out here and how damn near impossible it is…more",10 Oct 2023,2023,★★★★★,i realize im such a cliché for saying this but this movie really is the reason why im out here its the reason idoanything ive heard every complaint and critique and i just dont care this is the purest form of movie magic ive ever experienced and simply one of the most impactful and influential movies ive ever seenperiod it never shies away from how hard it is out here and how damn near impossible it ismore
La La Land,letterboxd,the reason i love la la land so much is because it captured a feeling... sky with no ceiling... the sunset without a frame,06 Apr 2020,2020,★★★★★,the reason i love la la land so much is because it captured a feeling sky with no ceiling the sunset without a frame
La La Land,letterboxd,what do you mean you don't like jazz?,13 Nov 2023,2023,★★★★★,what do you mean you dont like jazz
La La Land,letterboxd,"Rewatched this because Dunkey told me to and surprise surprise it's still magnificent. I'm not super into Ryan Gosling's performance but the gorgeous cinematography, breathtaking musical numbers, electric romantic chemistry, and sublime writing perfectly illustrate why Damien Chazelle is an absolute master of his craft. Not quite as perfect as Whiplash, but it does have the slightly better ending. Hell, maybe the best ending I've ever seen in a movie.",01 Sep 2019,2019,★★★★½,rewatched this because dunkey told me to and surprise surprise its still magnificent im not super into ryan goslings performance but the gorgeous cinematography breathtaking musical numbers electric romantic chemistry and sublime writing perfectly illustrate why damien chazelle is an absolute master of his craft not quite as perfect as whiplash but it does have the slightly better ending hell maybe the best ending ive ever seen in a movie
La La Land,letterboxd,"Perfect movie, perfect movie, perfect movie, perfect movie. Never not hitting.",04 May 2024,2024,★★★★★,perfect movie perfect movie perfect movie perfect movie never not hitting
La La Land,letterboxd,PEOPLE 👏 LOVE 👏 WHAT 👏 OTHER 👏 PEOPLE 👏 ARE 👏 PASSIONATE 👏 ABOUT 👏,03 Feb 2017,2017,★★★★★,people love what other people are passionate about
La La Land,letterboxd,"Occasionally a nice tonic, and pretty, but mostly a timid musical mixed with a bland romance. How the guy who made WHIPLASH failed...no, scratch that, barely even tried to make this take off until the last 20 minutes or so is baffling. Why does this plateau as soon as they get together? Why is so much of this (like say their one argument or the stories of their respective hopes)notin song? Where did all of Chazelle's energy go?",15 Nov 2016,2016,★★★,occasionally a nice tonic and pretty but mostly a timid musical mixed with a bland romance how the guy who made whiplash failedno scratch that barely even tried to make this take off until the last 20 minutes or so is baffling why does this plateau as soon as they get together why is so much of this like say their one argument or the stories of their respective hopesnotin song where did all of chazelles energy go
La La Land,letterboxd,you can’t just drive up to the griffith observatory door like that you would get arrested so fast,05 Jul 2025,2025,,you cant just drive up to the griffith observatory door like that you would get arrested so fast
La La Land,letterboxd,i literally started crying before i even pressed play,25 Nov 2018,2018,★★★★★,i literally started crying before i even pressed play
La La Land,letterboxd,"Admittedly, the storyline did lose me at certain points, but the phenomenal use of colour, lighting and music certainly made for a compelling watch. I can confirm that I did in fact enjoy this.",08 Feb 2023,2023,★★★½,admittedly the storyline did lose me at certain points but the phenomenal use of colour lighting and music certainly made for a compelling watch i can confirm that i did in fact enjoy this
La La Land,letterboxd,"this single handedly reinvented musicals, singing, dancing, cinematography, comedy, seasons of the year, the piano, every color on the entire color spectrum, romance, jazz and pure joyalso: 1. in the middle of the ending the projector messed up and so they played it back and i got to cry over that spectacular ending twice in a row, and 2. i met damien chazelle!",13 Oct 2016,2016,★★★★★,this single handedly reinvented musicals singing dancing cinematography comedy seasons of the year the piano every color on the entire color spectrum romance jazz and pure joyalso 1 in the middle of the ending the projector messed up and so they played it back and i got to cry over that spectacular ending twice in a row and 2 i met damien chazelle
La La Land,letterboxd,is this a horror movie,13 Apr 2024,2024,★★★★,is this a horror movie
La La Land,letterboxd,"Ayer fue una hermosa tarde de lluvia y la pasé encerrado en mi casa escribiendo, con Leia durmiendo al lado mío y el ruido del agua y los truenos de fondo. Una maravilla. Pero el universo, que es tremendo sorete, le gusta equilibrar las cosas y por eso a las nueve de la noche se cortó la luz para no volver.Me quedé un rato largo sentado en el sillón en plan“en un momento así solo se puede reír”…more",13 Mar 2024,2024,★★★★½,ayer fue una hermosa tarde de lluvia y la pasé encerrado en mi casa escribiendo con leia durmiendo al lado mío y el ruido del agua y los truenos de fondo una maravilla pero el universo que es tremendo sorete le gusta equilibrar las cosas y por eso a las nueve de la noche se cortó la luz para no volverme quedé un rato largo sentado en el sillón en planen un momento así solo se puede reírmore
La La Land,letterboxd,"Yes it is true: I hate joy.Okay but seriously, of all the movies you could fight about, y'all chose this? This is the movie nobody is allowed to dislike? Are you sure that there weren't any better candidates thanLa La Land? I'm honestly confused right now. I can see why it might appeal to some people but at the same time I don't think that it will ever become a classic because it's just not original enough.Sometimes…more",16 Jan 2017,2017,★★½,yes it is true i hate joyokay but seriously of all the movies you could fight about yall chose this this is the movie nobody is allowed to dislike are you sure that there werent any better candidates thanla la land im honestly confused right now i can see why it might appeal to some people but at the same time i dont think that it will ever become a classic because its just not original enoughsometimesmore
La La Land,letterboxd,How am I happy AND sad ?,24 Jan 2025,2025,★★★★★,how am i happy and sad
La La Land,letterboxd,HOT TAKE: This is a beautiful film.,24 Jan 2018,2018,★★★★½,hot take this is a beautiful film
La La Land,letterboxd,"""I'm Always Gonna Love You.""Quite literally a film that leaves me speechless, never failing to mesmerize me in its romantic story-telling and heartbreaking, yet awe-inspiring, character work and portrait of love. It’s so much more than just another romance film, though. It’s a tender tale of an evolving relationship burdened by dreams of success. An ode to old Hollywood filmmaking with its vibrant use of color and Pulp Fiction-esque production design. Chazelle feels as passionate as I’ve ever seen…more",01 Dec 2023,2023,★★★★★,im always gonna love youquite literally a film that leaves me speechless never failing to mesmerize me in its romantic storytelling and heartbreaking yet aweinspiring character work and portrait of love its so much more than just another romance film though its a tender tale of an evolving relationship burdened by dreams of success an ode to old hollywood filmmaking with its vibrant use of color and pulp fictionesque production design chazelle feels as passionate as ive ever seenmore
La La Land,letterboxd,"the ending of this movie sparked a strong and completely new emotional reaction in me, a mix of crying while dancing: cry-dancing, sometimes referred to as ""crancing""?, also known simply and elegantly as ""dying"" (source: me i guess)",05 Jan 2017,2017,★★★★★,the ending of this movie sparked a strong and completely new emotional reaction in me a mix of crying while dancing crydancing sometimes referred to as crancing also known simply and elegantly as dying source me i guess
La La Land,letterboxd,mia is so much stronger than me because if a man barged past me after playing that fuck ass piano i would’ve thrown some hands,13 Mar 2024,2024,★★★★★,mia is so much stronger than me because if a man barged past me after playing that fuck ass piano i wouldve thrown some hands
La La Land,letterboxd,"This happened to me once when I played toontown in 2010. I had a girlfriend who I'd go on the trolley with everyday. Then one day, she gets mad at me... It was trolley tracks and i didn't want to play the game that she wanted to. She voted for a different game and I became erratic. I yelled at her. She left me. Weeks go by, no contact. We had a mutual friend who would tell me how she…more",04 Aug 2023,2023,★★★★★,this happened to me once when i played toontown in 2010 i had a girlfriend who id go on the trolley with everyday then one day she gets mad at me it was trolley tracks and i didnt want to play the game that she wanted to she voted for a different game and i became erratic i yelled at her she left me weeks go by no contact we had a mutual friend who would tell me how shemore
La La Land,letterboxd,My love for this movie is immeasurable.,13 Mar 2023,2023,★★★★★,my love for this movie is immeasurable
La La Land,letterboxd,"While I'm an emotional wreck with swollen eyes, this film will hold a special place in my heart",23 Sep 2022,2022,★★★★★,while im an emotional wreck with swollen eyes this film will hold a special place in my heart
La La Land,letterboxd,"Fair warning, only because a portion of the reviews make it out to be some kind of bright, cheery, optimistic film --La La Landleft me in one of the most profoundly depressed states of any film I've seen this year. I decided to watch it twice tonight and I don't even know why (okay actually I do), because now I'm just despondent.",17 Dec 2016,2016,★★★★,fair warning only because a portion of the reviews make it out to be some kind of bright cheery optimistic film la la landleft me in one of the most profoundly depressed states of any film ive seen this year i decided to watch it twice tonight and i dont even know why okay actually i do because now im just despondent
La La Land,letterboxd,Ryan Gosling and Emma Stone are the reasons in my humble opinion the masses have gone Ga Ga for La La Land. The It Guy. The It Girl. A romance for the ages. The couple we all love. It's The Notebook without the sappy ending for the millennial generation. Take away Ryan and Emma and I'm betting most of you would give zero fucks about La La Land.La La Land is being sold as the second coming of the…more,09 Apr 2017,2017,★★★,ryan gosling and emma stone are the reasons in my humble opinion the masses have gone ga ga for la la land the it guy the it girl a romance for the ages the couple we all love its the notebook without the sappy ending for the millennial generation take away ryan and emma and im betting most of you would give zero fucks about la la landla la land is being sold as the second coming of themore
La La Land,letterboxd,filmmaking nearer the gods. perfect film. no notes.,09 Dec 2024,2024,★★★★★,filmmaking nearer the gods perfect film no notes
La La Land,letterboxd,TIFF 2016 Film #17Cinema has officially been reborn.La La Landis one of the most enjoyable movie experiences I've ever had. This movie gives me life. It's absolutely electrifying. There's a big musical number before the movie even really starts and at that moment I knew we had a special film on our hands.Emma Stone is coming for that Oscar. Her and Ryan Gosling were dynamite as a pair. We all need to be very thankful that…more,12 Sep 2016,2016,★★★★★,tiff 2016 film has officially been rebornla la landis one of the most enjoyable movie experiences ive ever had this movie gives me life its absolutely electrifying theres a big musical number before the movie even really starts and at that moment i knew we had a special film on our handsemma stone is coming for that oscar her and ryan gosling were dynamite as a pair we all need to be very thankful thatmore
La La Land,letterboxd,in my headi play a supercut of usall the magic we gave offall the love we had and lostand in my headthe visions never stopthese ribbons wrap me upbut when i reach for youthere's just a supercut,26 Jul 2019,2019,★★★★★,in my headi play a supercut of usall the magic we gave offall the love we had and lostand in my headthe visions never stopthese ribbons wrap me upbut when i reach for youtheres just a supercut
La La Land,letterboxd,you know that scene when they’re walking through the lot and mia stops in to look at one of the sets and she just says “i love it.” yeah that’s me watching this movie,31 Oct 2018,2018,★★★★★,you know that scene when theyre walking through the lot and mia stops in to look at one of the sets and she just says i love it yeah thats me watching this movie
La La Land,letterboxd,"Yes, black people are used as props. Yes, a white man wants to save a black art form from being tainted by a black man. Yes, he succeeds in this goal. Yes, in a white man’s passionate spiel about the history of jazz, blackness isn’t mentioned once. Yes, a white man fetishizes a black art form from a time where black people were treated like shit (not like we still aren’t). These are annoying but are nowhere near my biggest…more",04 Jan 2020,2020,★★,yes black people are used as props yes a white man wants to save a black art form from being tainted by a black man yes he succeeds in this goal yes in a white mans passionate spiel about the history of jazz blackness isnt mentioned once yes a white man fetishizes a black art form from a time where black people were treated like shit not like we still arent these are annoying but are nowhere near my biggestmore
La La Land,letterboxd,still goodstill makes me cry,31 Mar 2023,2023,★★★★★,still goodstill makes me cry
