movie,platform,review_text,date,year,rating,clean_text
La La Land,letterboxd,"“Here’s to the ones who dream, foolish as they may seem”Revisiting this movie might not have been the happiest way to close the year but it was exactly what I needed. I’ve realized how much I’ve grown when I’m finally able to give it 5 stars. The older I get, the more I relate to these characters, their hopes, their fears and the bittersweet journey of being a big dreamer.Wishing you all a 2025 filled with dreams coming true, but without the heartbreak of endings like this one. Thank you for all the love and support this year 🤍",31 Dec 2024,2024,★★★★★,heres to the ones who dream foolish as they may seemrevisiting this movie might not have been the happiest way to close the year but it was exactly what i needed ive realized how much ive grown when im finally able to give it 5 stars the older i get the more i relate to these characters their hopes their fears and the bittersweet journey of being a big dreamerwishing you all a 2025 filled with dreams coming true but without the heartbreak of endings like this one thank you for all the love and support this year
La La Land,letterboxd,"People, things, and music have the power to hold such memories that when they bring nostalgia, they will surely fuck you up with the question: ""What could have been?"" Oh, la la land. La la luv it!",13 Aug 2022,2022,★★★★★,people things and music have the power to hold such memories that when they bring nostalgia they will surely fuck you up with the question what could have been oh la la land la la luv it
La La Land,letterboxd,"Down to every single detail, this movie is a masterpiece. It’s a miracle this exists.",15 Feb 2026,2026,★★★★★,down to every single detail this movie is a masterpiece its a miracle this exists
La La Land,letterboxd,the only movie ever made.,18 Oct 2023,2023,★★★★★,the only movie ever made
La La Land,letterboxd,"Había olvidado lo bella que esLa La Landy lo mucho que necesitaba su gran mensaje.Solía creer que sólo era una historia de amor romántico mostrando lo cruel que es estar enamorado, pero en verdad trata sobre el amor hacía los sueños ""imposibles"" que todos necesitamos en la vida. El enamorarnos de la pasión que tanto nos llena el poder conseguirlos, pero tomando las decisiones más dolorosas pero maduras para lograrlos.Mia & Sebastian me parecen personajes muy completos…more",14 Jan 2023,2023,★★★★★,había olvidado lo bella que esla la landy lo mucho que necesitaba su gran mensajesolía creer que sólo era una historia de amor romántico mostrando lo cruel que es estar enamorado pero en verdad trata sobre el amor hacía los sueños imposibles que todos necesitamos en la vida el enamorarnos de la pasión que tanto nos llena el poder conseguirlos pero tomando las decisiones más dolorosas pero maduras para lograrlosmia sebastian me parecen personajes muy completosmore
La La Land,letterboxd,"DID YOU KNOW: 'la la land' is actually an anagram of 'the most wonderful, the most beautiful, the most exciting and musical and hopeful and dream-like film of all time.'",07 Dec 2016,2016,★★★★★,did you know la la land is actually an anagram of the most wonderful the most beautiful the most exciting and musical and hopeful and dreamlike film of all time
La La Land,letterboxd,"career vs love - the loss of romanticism through the avid craving of personal fulfilment. Chazelle is ""whiplashing"" a little bit in the final moment, but not in the denying way he did it in his predecessor, so you can fully enjoy his ride to the depths of melancholy brought to you rather by jazz fingers than dancing legs.",22 Nov 2016,2016,★★★★½,career vs love the loss of romanticism through the avid craving of personal fulfilment chazelle is whiplashing a little bit in the final moment but not in the denying way he did it in his predecessor so you can fully enjoy his ride to the depths of melancholy brought to you rather by jazz fingers than dancing legs
La La Land,letterboxd,"— wow, is that gonna happen every time?— i think sola la land é um musical que te abraça mas te esfaqueia ao mesmo tempo. a direção do filme é cirúrgica, que consegue fazer o filme ter todo aquele sentimento envolvido, colore o filme com cores lindas e vibrantes, músicas vibrantes, mas no fundo o filme vai além de um romance musical e traz uma importante reflexão: vida nem sempre é sobre juntar amor e sonho no mesmo…more",16 Aug 2025,2025,★★★★½,wow is that gonna happen every time i think sola la land é um musical que te abraça mas te esfaqueia ao mesmo tempo a direção do filme é cirúrgica que consegue fazer o filme ter todo aquele sentimento envolvido colore o filme com cores lindas e vibrantes músicas vibrantes mas no fundo o filme vai além de um romance musical e traz uma importante reflexão vida nem sempre é sobre juntar amor e sonho no mesmomore
La La Land,letterboxd,can let the gang know i heavily fw this movie so much.,06 Sep 2024,2024,★★★★★,can let the gang know i heavily fw this movie so much
La La Land,letterboxd,"saw a certain someone™ today, had a mini mental breakdown and had to watch this as soon as i got home, 10/10 immersive experience i bawled throughout the entire film",13 Mar 2024,2024,★★★★½,saw a certain someone today had a mini mental breakdown and had to watch this as soon as i got home 1010 immersive experience i bawled throughout the entire film
La La Land,letterboxd,i'm always gonna love you too.,01 Jan 2026,2026,★★★★★,im always gonna love you too
La La Land,letterboxd,Whitest movie ever to be made about jazz?,05 Aug 2017,2017,★★★★,whitest movie ever to be made about jazz
La La Land,letterboxd,greatest horror movie of all time,26 Jul 2024,2024,★★★★★,greatest horror movie of all time
La La Land,letterboxd,The greatest thing you’ll ever learn is to love and be loved in return.,30 Dec 2019,2019,★★★★½,the greatest thing youll ever learn is to love and be loved in return
La La Land,letterboxd,"me: i don't think about this film That muchcar: honksme: La La Land is a 2016 American musical romantic comedy-drama film written and directed by Damien Chazelle, and starring Ryan Gosling and Emma Stone as a musi",28 Feb 2017,2017,★★★★★,me i dont think about this film that muchcar honksme la la land is a 2016 american musical romantic comedydrama film written and directed by damien chazelle and starring ryan gosling and emma stone as a musi
La La Land,letterboxd,"“it's pretty strange that we keep running into each other”“maybe it means something”. ۫ ꣑ৎ .visually flawless, emotionally timeless",26 Oct 2025,2025,★★★★★,its pretty strange that we keep running into each othermaybe it means something ꣑ৎ visually flawless emotionally timeless
La La Land,letterboxd,La La Land wants you to take in its beauty and get to know its young dreamers. The ending packs an emotional punch but most of the ride is a joyous visual feast that just wants you to have a good time.,04 Oct 2024,2024,★★★★★,la la land wants you to take in its beauty and get to know its young dreamers the ending packs an emotional punch but most of the ride is a joyous visual feast that just wants you to have a good time
La La Land,letterboxd,guess i'll see you in the movies,14 Mar 2024,2024,★★★★★,guess ill see you in the movies
La La Land,letterboxd,you can't tell me that's not ken,13 Feb 2025,2025,★★★★★,you cant tell me thats not ken
La La Land,letterboxd,Watched my favorite horror film for this Halloween. I’m not okay 😭💔,31 Oct 2025,2025,★★★★★,watched my favorite horror film for this halloween im not okay
La La Land,letterboxd,Here's to the ones who dreamFoolish as they may seemHere's to the hearts that acheHere's to the mess we make,16 Aug 2025,2025,★★★★½,heres to the ones who dreamfoolish as they may seemheres to the hearts that acheheres to the mess we make
La La Land,letterboxd,Is Ryan Gosling this generations Humphrey Bogart?,03 Aug 2023,2023,★★★★★,is ryan gosling this generations humphrey bogart
La La Land,letterboxd,آخر فيلم قبل رمضان، كل سنة وانتوا طيبين وربنا يعود عليكم الأيام بخير ويكون شهر كويس على الكلمن بعد رمضان اللي فات ما خلص وأنا كل يوم بشوف فيلم ودي واحدة من أجمل التجارب اللي عملتها في حياتي وفي الفترة دي اتعرفت على كتير منكم وبجد من أحسن الناس اللي بتعرف عليهم وأقرب الناس ليااتمنى لو تفتكروني بدعواتكم الشهر دة عشان أنا تالتة ثانوي وخلاص السنة بتخلصI'm always gonna love you.I'm always gonna love you too.,18 Feb 2026,2026,★★★★★,آخر فيلم قبل رمضان كل سنة وانتوا طيبين وربنا يعود عليكم الأيام بخير ويكون شهر كويس على الكلمن بعد رمضان اللي فات ما خلص وأنا كل يوم بشوف فيلم ودي واحدة من أجمل التجارب اللي عملتها في حياتي وفي الفترة دي اتعرفت على كتير منكم وبجد من أحسن الناس اللي بتعرف عليهم وأقرب الناس ليااتمنى لو تفتكروني بدعواتكم الشهر دة عشان أنا تالتة ثانوي وخلاص السنة بتخلصim always gonna love youim always gonna love you too
La La Land,letterboxd,me and ryan have the same birthday…guys im telling you he’s my soulmate,24 May 2024,2024,★★★★★,me and ryan have the same birthdayguys im telling you hes my soulmate
La La Land,letterboxd,It always takes me off guard how good Emma Stone is in this movie.,26 Jun 2022,2022,★★★★★,it always takes me off guard how good emma stone is in this movie
La La Land,letterboxd,"i can’t anymore with the edits “he succeeded in music, she succeeded in acting” after the oscars. only when i thought i recovered from this movie, 5 years later it comes to haunt me.ps: emma singing along to “i’m just ken” with ryan healed something in me ❤️‍🩹",15 Mar 2024,2024,★★★★★,i cant anymore with the edits he succeeded in music she succeeded in acting after the oscars only when i thought i recovered from this movie 5 years later it comes to haunt meps emma singing along to im just ken with ryan healed something in me
La La Land,letterboxd,"One day I'm gonna rewatch this movie and they're gonna end up together, I just know it! 😃**I am delusional",06 Jan 2024,2024,★★★★★,one day im gonna rewatch this movie and theyre gonna end up together i just know it i am delusional
La La Land,letterboxd,"Every time I start to feel that strange feeling of happiness and well-being ""La La Land"" comes to the rescue, restoring the correct balance of melancholy and broken heart",18 Dec 2024,2024,★★★★★,every time i start to feel that strange feeling of happiness and wellbeing la la land comes to the rescue restoring the correct balance of melancholy and broken heart
La La Land,letterboxd,me: thank you for changing my lifela la land: i made you life worse,16 Aug 2024,2024,★★★★★,me thank you for changing my lifela la land i made you life worse
La La Land,letterboxd,it’s so hard to put into words how this film makes me feel.. genuinely no other piece of media has made me feel like this. Thank you Damien chazelle.“Here’s to the fools who dream” 💜,20 Sep 2024,2024,★★★★★,its so hard to put into words how this film makes me feel genuinely no other piece of media has made me feel like this thank you damien chazelleheres to the fools who dream
La La Land,letterboxd,"i wanna try and start a conversation: what do you think the line near the end ""i've never been here during the day"" means? why do you think they picked that to be the last thing said on-screen between mia & sebastian? i have my own interpretation but i don't think it's good enough and it has bothered me since i watched it for the first time. please let me know what you think!!",28 Nov 2017,2017,,i wanna try and start a conversation what do you think the line near the end ive never been here during the day means why do you think they picked that to be the last thing said onscreen between mia sebastian i have my own interpretation but i dont think its good enough and it has bothered me since i watched it for the first time please let me know what you think
La La Land,letterboxd,I don't understand why everybody is so ga‑ga about La La Land. It’s the most overrated movie I have ever seen It had one of the most generic B-rated plots ever the OSTs were awful Ryan Gosling is a terrible singer and you call that dancing? There was barely any dancing! The story lacks a logical narrative structure with key moments rushing by far too quickly and feeling emotionally disconnected The middle sags leading to the most gratuitous emotionally manipulative ending I’ve ever seen.,10 Dec 2025,2025,½,i dont understand why everybody is so gaga about la la land its the most overrated movie i have ever seen it had one of the most generic brated plots ever the osts were awful ryan gosling is a terrible singer and you call that dancing there was barely any dancing the story lacks a logical narrative structure with key moments rushing by far too quickly and feeling emotionally disconnected the middle sags leading to the most gratuitous emotionally manipulative ending ive ever seen
La La Land,letterboxd,"The happiest sad movie I've ever seen!I still remember the time when I first saw La La Land. Twenty minutes in, I was like, 'Wow, so much dancing and fun, this is going to be a silly musical.' But while watching, the last 20 minutes were pure magic; it gave me feelings I never had before and might never have again. Probably the best 20 minutes I've ever experienced in a movie.The chemistry between Emma Stone and Ryan…more",14 Feb 2024,2024,★★★★★,the happiest sad movie ive ever seeni still remember the time when i first saw la la land twenty minutes in i was like wow so much dancing and fun this is going to be a silly musical but while watching the last 20 minutes were pure magic it gave me feelings i never had before and might never have again probably the best 20 minutes ive ever experienced in a moviethe chemistry between emma stone and ryanmore
La La Land,letterboxd,"En ese travelling lateral donde Seb decide tocar el leivmotiv de la película porque nadie le estaba prestando atención y consigue, sin saberlo, atraer al amor de su vida; en ese travelling lateral donde Mia decide abandonar a su novio porque escucho en la radio de un restaurante la misma melodia que tocó Seb cuando se conocieron y que nadie más prestó atención en el lugar; en ese travelling circular en el que Seb se da cuenta que esta enamorado,…more",09 Dec 2023,2023,★★★★★,en ese travelling lateral donde seb decide tocar el leivmotiv de la película porque nadie le estaba prestando atención y consigue sin saberlo atraer al amor de su vida en ese travelling lateral donde mia decide abandonar a su novio porque escucho en la radio de un restaurante la misma melodia que tocó seb cuando se conocieron y que nadie más prestó atención en el lugar en ese travelling circular en el que seb se da cuenta que esta enamoradomore
La La Land,letterboxd,"some people have boyfriends, some people have girlfriends, i have la la land (2016) dir. damien chazelle",11 Nov 2020,2020,★★★★★,some people have boyfriends some people have girlfriends i have la la land 2016 dir damien chazelle
La La Land,letterboxd,"when the house lights come up because the show is over, and the person sitting next to you isn't me...then what do we do?(i need to stop watching this film at 2 am)",27 Jul 2024,2024,★★★★★,when the house lights come up because the show is over and the person sitting next to you isnt methen what do we doi need to stop watching this film at 2 am
La La Land,letterboxd,"If this doesn't, at minimum, win Best Original Song for this year's Oscars, and prompt a beautiful onstage performance at the ceremony, I will purchase and eat some form of hat.But I suspect it'll also be in play for Best Picture. It's beautiful, lively, engaging, emotional, and surprising, and it's something Hollywood loves: a nostalgia reverie reminding us all how great Old Hollywood was. I cried for sheer joy during the opening scene, that's how much I loved this movie.",12 Sep 2016,2016,★★★★½,if this doesnt at minimum win best original song for this years oscars and prompt a beautiful onstage performance at the ceremony i will purchase and eat some form of hatbut i suspect itll also be in play for best picture its beautiful lively engaging emotional and surprising and its something hollywood loves a nostalgia reverie reminding us all how great old hollywood was i cried for sheer joy during the opening scene thats how much i loved this movie
La La Land,letterboxd,A perfect horror movie does not exi--,28 Jul 2025,2025,★★★★★,a perfect horror movie does not exi
La La Land,letterboxd,"""I guess I'll see you in the movies.""Movie magic in its purest form 😌",18 Dec 2024,2024,★★★★★,i guess ill see you in the moviesmovie magic in its purest form
La La Land,letterboxd,"""I'm Always Gonna Love You.""Short form review:Liked- Ryan Gosling and Emma Stone make for one of the most beautiful depressing duos of cinema!Disliked- n/aOverall thoughts- I loved La La Landand need to pick up the 4k Blu-Ray as soon as feasibly possible!!",31 Mar 2024,2024,★★★★½,im always gonna love youshort form reviewliked ryan gosling and emma stone make for one of the most beautiful depressing duos of cinemadisliked naoverall thoughts i loved la la landand need to pick up the 4k bluray as soon as feasibly possible
La La Land,letterboxd,"This film has four seasons SPRING, SUMMER, FALL, WINTER where each season has memorable meaning.This film is the most realistic thing I've ever seen loving someone doesn't always mean that love is enough.And the end of this movie, broke my heart to piecesIn the end, i think this movie is like Andrew Garfield and Emma Stone, their story in a movie",13 Nov 2022,2022,★★★★★,this film has four seasons spring summer fall winter where each season has memorable meaningthis film is the most realistic thing ive ever seen loving someone doesnt always mean that love is enoughand the end of this movie broke my heart to piecesin the end i think this movie is like andrew garfield and emma stone their story in a movie
La La Land,letterboxd,how does one inject a movie into their veins,13 Mar 2018,2018,★★★★★,how does one inject a movie into their veins
La La Land,letterboxd,"The soundtrack, actors, effects, lights and editing are of course really good, but the plot is just so simple and sometimes even banal",14 Aug 2024,2024,★★★,the soundtrack actors effects lights and editing are of course really good but the plot is just so simple and sometimes even banal
La La Land,letterboxd,"incase you didn't know, this movie ruined my life",25 Dec 2017,2017,★★★★★,incase you didnt know this movie ruined my life
La La Land,letterboxd,Are we really going to be talking about any other 2016 release's ending come the 31st!?,16 Dec 2016,2016,★★★★,are we really going to be talking about any other 2016 releases ending come the 31st
La La Land,letterboxd,"Have lost track of how many times I've seen this movie now. Was lucky enough to see it at the Hollywood Bowl with an orchestra scoring it live, and goddamn- still think this movie is a masterpiece, and this time around I realized how great the direction in it is. It's a stunning example of ""show, don't tell."" I loved Moonlight and think Barry Jenkins is a fantastic director, but I feel like giving Best Director to La La Land was the right move.",27 May 2017,2017,★★★★★,have lost track of how many times ive seen this movie now was lucky enough to see it at the hollywood bowl with an orchestra scoring it live and goddamn still think this movie is a masterpiece and this time around i realized how great the direction in it is its a stunning example of show dont tell i loved moonlight and think barry jenkins is a fantastic director but i feel like giving best director to la la land was the right move
La La Land,letterboxd,"COMMENT un seul et même film peut me faire sourire jusqu’à m’en donner des crampes aux joues, puis faire couler touutes mes larmes pendant le dernier quart d’heure ????? sorcellerie",09 Feb 2024,2024,★★★★★,comment un seul et même film peut me faire sourire jusquà men donner des crampes aux joues puis faire couler touutes mes larmes pendant le dernier quart dheure sorcellerie
La La Land,letterboxd,This is equally my Valentines Day movie. ❤️,14 Feb 2023,2023,★★★★★,this is equally my valentines day movie
La La Land,letterboxd,"""its just a movie...""no, its not.",13 Nov 2024,2024,★★★★★,its just a movieno its not
La La Land,letterboxd,best thing about movies or i guess art in general is that sometimes you will engage with it and not have an immediate appreciation for it and you’re passive or sometimes you just don’t really care for it like that. but then you get older and then you go through life’s challenges and then you stumble upon that film or that painting or that song or that book again and everything clicks and you cry because it finally makes sense,07 Dec 2025,2025,★★★★★,best thing about movies or i guess art in general is that sometimes you will engage with it and not have an immediate appreciation for it and youre passive or sometimes you just dont really care for it like that but then you get older and then you go through lifes challenges and then you stumble upon that film or that painting or that song or that book again and everything clicks and you cry because it finally makes sense
La La Land,letterboxd,This movie is just beautifulthat's the best way to describe this movieyou got Ryan Gosling (AKA me) & Emma Stone who have great chemistry with one anotheryou got Damien Chazelle's incredible directingyou also got Damien's incredible writing& the incredible scoreall comes together to make a Masterpiece of the Romantic genreI love how passionate Damien Chazelle is for jazzyou can tell that every time he makes a moviehe wants the score to be jazz…more,10 Nov 2023,2023,★★★★★,this movie is just beautifulthats the best way to describe this movieyou got ryan gosling aka me emma stone who have great chemistry with one anotheryou got damien chazelles incredible directingyou also got damiens incredible writing the incredible scoreall comes together to make a masterpiece of the romantic genrei love how passionate damien chazelle is for jazzyou can tell that every time he makes a moviehe wants the score to be jazzmore
La La Land,letterboxd,"I can write everything I love about La La Land, but really the most important thing is that it makes me happy, it's one of those movies that I can watch a thousand times and I will always have a smile on my face. At the end of the day that's what matters most.",27 Mar 2021,2021,★★★★★,i can write everything i love about la la land but really the most important thing is that it makes me happy its one of those movies that i can watch a thousand times and i will always have a smile on my face at the end of the day thats what matters most
La La Land,letterboxd,why did they have to be assholes and end the movie like that,26 Nov 2019,2019,★★★★★,why did they have to be assholes and end the movie like that
La La Land,letterboxd,For the second time even better and even more beautiful like a sound of jazz melody (I just pretend that ending doesn't exist),17 Jan 2025,2025,★★★★,for the second time even better and even more beautiful like a sound of jazz melody i just pretend that ending doesnt exist
La La Land,letterboxd,"It matches Hollywood perfectly, very pretty, white, and vapid.",18 Feb 2017,2017,★½,it matches hollywood perfectly very pretty white and vapid
La La Land,letterboxd,I am currently ashamed of myself for even thinking that this would end happily and now I am contemplating life choices,03 Feb 2026,2026,★★★★★,i am currently ashamed of myself for even thinking that this would end happily and now i am contemplating life choices
La La Land,letterboxd,"i got the opportunity to rewatchLa La Landin a theater and was immediately reminded why i’ve been keeping my distance. still a masterpiece, still shelving it for the foreseeable future.",07 Jun 2025,2025,★★★★★,i got the opportunity to rewatchla la landin a theater and was immediately reminded why ive been keeping my distance still a masterpiece still shelving it for the foreseeable future
La La Land,letterboxd,"I’ve only felt this captivated about a selective few films ever & la la land is definitely one of them… so magical. ryan & emmas chemistry their performances damiens direction, the beautiful cinematography & the soundtrack just woah.. city of stars is one of my favorite original songs from a film ever. Just wow I’m speechless.",02 Feb 2023,2023,★★★★★,ive only felt this captivated about a selective few films ever la la land is definitely one of them so magical ryan emmas chemistry their performances damiens direction the beautiful cinematography the soundtrack just woah city of stars is one of my favorite original songs from a film ever just wow im speechless
