movie,platform,review_text,date,year,rating,clean_text
La La Land,letterboxd,really thought i wasn't gonna like this especially from the opening scene. i actually tried watching this like over a year ago and stopped not even half way through the movie but whoa this was actually really good!!!!my heart is broken it was so beautifully sad!! and the ending was perfect don't come for me!!!! loved it!!!♡♡♡♡,07 Sep 2025,2025,★★★★,really thought i wasnt gonna like this especially from the opening scene i actually tried watching this like over a year ago and stopped not even half way through the movie but whoa this was actually really goodmy heart is broken it was so beautifully sad and the ending was perfect dont come for me loved it
La La Land,letterboxd,"“Here’s to the fools who dream”literally me 24/7 so I couldn’t choose other film than this to start my 21s, thank you once again Damien <3",03 Aug 2024,2024,★★★★★,heres to the fools who dreamliterally me 247 so i couldnt choose other film than this to start my 21s thank you once again damien 3
La La Land,letterboxd,"Amo tanto esse filme, realmente muitos ciclos tem um final e eu gosto como isso é representado aqui. A cena do epílogo é tão perfeita, amo muito, queria poder assistir como se fosse a primeira vez 😭❤️",16 Jul 2024,2024,★★★★★,amo tanto esse filme realmente muitos ciclos tem um final e eu gosto como isso é representado aqui a cena do epílogo é tão perfeita amo muito queria poder assistir como se fosse a primeira vez
La La Land,letterboxd,"“I'm waiting for you, I'm waiting for the evening calm, I'm waiting for our time, the oblique light, this pause between day and night. Peace will come, surely. But I can imagine no other peace than that of our two bodies bound together, of our gaze given over to each other—I have no other homeland but you.”This is a fragment of Albert Camus' correspondence to Maria Casares. July 17th, 1949.",18 Mar 2024,2024,★★★★★,im waiting for you im waiting for the evening calm im waiting for our time the oblique light this pause between day and night peace will come surely but i can imagine no other peace than that of our two bodies bound together of our gaze given over to each otheri have no other homeland but youthis is a fragment of albert camus correspondence to maria casares july 17th 1949
La La Land,letterboxd,"""Is this the start of something wonderful and new?Or one more dream that I cannot make true?""What can I possibly say that hasn't already been said? This is cinema!Mind you that Sebastian is in fact a gentleman, he went to seeRebel Without a Causewearing a suit and drove, at least, 4 hours from LA to Boulder City. He's the right and only man ever.",23 Mar 2023,2023,★★★★★,is this the start of something wonderful and newor one more dream that i cannot make truewhat can i possibly say that hasnt already been said this is cinemamind you that sebastian is in fact a gentleman he went to seerebel without a causewearing a suit and drove at least 4 hours from la to boulder city hes the right and only man ever
La La Land,letterboxd,"Sorry, I still really like this despite all the “50% off all tops and dresses! — In stores and online — Only at Old Navy!” energy.",13 Apr 2021,2021,★★★★,sorry i still really like this despite all the 50 off all tops and dresses in stores and online only at old navy energy
La La Land,letterboxd,"never recovered from the fact that I walked out of this movie and said verbatim, “I feel like that movie was made forme!” and then every person I respect said this movie is stupid and represents everything wrong with Hollywood and I had to reckon with myself 😕Here’s to the fools (me) who dream!!",03 Aug 2020,2020,,never recovered from the fact that i walked out of this movie and said verbatim i feel like that movie was made forme and then every person i respect said this movie is stupid and represents everything wrong with hollywood and i had to reckon with myself heres to the fools me who dream
La La Land,letterboxd,"After having to wait for weeks for this film to play near me, I have finally gotten a chance to go out and see Damien Chazelle's La La Land. And after seeing it, I can honestly say that it was absolutely worth the wait because this film is phenomenal in just about every way. The story is engaging, the script and writing is brilliant, the characters are lovable, the soundtrack is masterful, the performances are terrific and Ryan Gosling and…more",14 Jan 2017,2017,★★★★★,after having to wait for weeks for this film to play near me i have finally gotten a chance to go out and see damien chazelles la la land and after seeing it i can honestly say that it was absolutely worth the wait because this film is phenomenal in just about every way the story is engaging the script and writing is brilliant the characters are lovable the soundtrack is masterful the performances are terrific and ryan gosling andmore
La La Land,letterboxd,"Not typically my kind of thing, but it’s of course objectively beautiful and captivating in many ways. I can see why it’s in a lot of people’s favourites.",16 Feb 2026,2026,★★★★,not typically my kind of thing but its of course objectively beautiful and captivating in many ways i can see why its in a lot of peoples favourites
La La Land,letterboxd,"Donc là je viens d'ENFIN voir mon film préféré de tout les temps d'amour au cinéma ??? J'ai même pas les mots je vous jure c'était littéralement PARFAIT ?! J'ai tellement pleurer surtout pendant la scène du planetarium, elle est parfaite STOPP COMMENT C'EST POSSIBLE. Un truc de fou honnêtement c'était mon rêve et il s'est enfin réalisé 🥹<3 Je peux avoir un Sebastian ( Ryan Gosling ) aussi svp ? Je rigole j'en ai déjà un 😎",07 Feb 2026,2026,★★★★★,donc là je viens denfin voir mon film préféré de tout les temps damour au cinéma jai même pas les mots je vous jure cétait littéralement parfait jai tellement pleurer surtout pendant la scène du planetarium elle est parfaite stopp comment cest possible un truc de fou honnêtement cétait mon rêve et il sest enfin réalisé 3 je peux avoir un sebastian ryan gosling aussi svp je rigole jen ai déjà un
La La Land,letterboxd,so i fear my expectations were extremely high. i enjoyed the cinematography and everything but i just didn’t really care and i don’t think i understood why everyone really enjoys this. i think it was also just really long to me. it was okay..,24 Jan 2026,2026,★★½,so i fear my expectations were extremely high i enjoyed the cinematography and everything but i just didnt really care and i dont think i understood why everyone really enjoys this i think it was also just really long to me it was okay
La La Land,letterboxd,"I wonder how many jazz clubs spawned with ""[insert shortened first name] 's"" because of this movie? 20 to 30, across every town and street, I presumeAnd for anyone wondering, it doesn't get any less painful on rewatch. Them locking eyes in Seb's is what gets me EVERY. SINGLE. TIME.",08 Mar 2025,2025,★★★★★,i wonder how many jazz clubs spawned with insert shortened first name s because of this movie 20 to 30 across every town and street i presumeand for anyone wondering it doesnt get any less painful on rewatch them locking eyes in sebs is what gets me every single time
La La Land,letterboxd,"there’s nothing i despise more than the enemies to lovers troupe in any form of media BUT BUTBUTBJTBUTBUTBUTBUT☝️ this movie is the only one for me that does it right and the only one that i can accept, respect and love. AND YOU KNOW HOW MUCH I HAVE TO LOVE IT TO REWATCH IT AS A PERSON WHO TENDS TO NOT REWATCH STUFF? i think about this movie and their dynamic and i get so excited i start shaking like my nana's chihuahua",10 May 2024,2024,★★★★½,theres nothing i despise more than the enemies to lovers troupe in any form of media but butbutbjtbutbutbutbut this movie is the only one for me that does it right and the only one that i can accept respect and love and you know how much i have to love it to rewatch it as a person who tends to not rewatch stuff i think about this movie and their dynamic and i get so excited i start shaking like my nanas chihuahua
La La Land,letterboxd,"A practically perfect passion project that seamlessly blends music, romance, drama, and fantasy while paying homage to Hollywood through real locations, stunning set pieces, and easter eggs everywhere. Ryan Gosling gives an impressive showing but Emma Stone steals the show with a wide-eyed and stargazing performance as they both strive for greatness. With it being the most nominated Oscar film ever, it rightfully won a lot of major awards including Best Director, Best Actress, and Best Cinematography and now I totally…more",28 Dec 2023,2023,★★★★½,a practically perfect passion project that seamlessly blends music romance drama and fantasy while paying homage to hollywood through real locations stunning set pieces and easter eggs everywhere ryan gosling gives an impressive showing but emma stone steals the show with a wideeyed and stargazing performance as they both strive for greatness with it being the most nominated oscar film ever it rightfully won a lot of major awards including best director best actress and best cinematography and now i totallymore
La La Land,letterboxd,idk what else to say besides this is a perfect film. not a single flaw. i love it so much and it’s so special to me. THE COLORS!!!! it’s so pretty. there’s never a boring moment. emma and ryan are just so fucking good 😭 and the ending always destroys me like i’m an absolute wreck right now. damien chazelle please never stop making movies.,06 Feb 2023,2023,★★★★★,idk what else to say besides this is a perfect film not a single flaw i love it so much and its so special to me the colors its so pretty theres never a boring moment emma and ryan are just so fucking good and the ending always destroys me like im an absolute wreck right now damien chazelle please never stop making movies
La La Land,letterboxd,"Rewatched in class for the first time in years and I’ve gained a lot of newfound appreciation for it. The ending is so damn good as well, really well done.",01 Oct 2021,2021,★★★★,rewatched in class for the first time in years and ive gained a lot of newfound appreciation for it the ending is so damn good as well really well done
La La Land,letterboxd,"Great opening to a perfect movie. It's so magical and you don't want the ride to end. I love films that have a strong message behind them, and this is one of them. The pain and heartbreak you go through to persue your passion, to never give up, and that dreams do come true.Gosling and Stone are just perfect in their roles. I can see why they like to work together, the chemistry they share is something special. I…more",14 Jan 2021,2021,★★★★★,great opening to a perfect movie its so magical and you dont want the ride to end i love films that have a strong message behind them and this is one of them the pain and heartbreak you go through to persue your passion to never give up and that dreams do come truegosling and stone are just perfect in their roles i can see why they like to work together the chemistry they share is something special imore
La La Land,letterboxd,painfully devoid of sexual tension. you could easily make the film and the core relationship so much more believable if you convinced me that they fuck. they don’t. Sebastian is probably a virgin,17 Jul 2020,2020,★★★★½,painfully devoid of sexual tension you could easily make the film and the core relationship so much more believable if you convinced me that they fuck they dont sebastian is probably a virgin
La La Land,letterboxd,"Mia’s eyes drift as she heads to the bar. She recognizes the sign 'Seb's'. The images on the wall and the stool Sebastian’s, formerly Hoagy Carmichael’s.Mia finds a seat with her husband. As the combo finishes their set a large applause appears.And just then Sebastian appears. Mia looks at him,frozen, her heart beating faster. As Sebastian names the members of the band he looks at the crowd and sees Mia.The two lock eyes and you can…more",15 Jun 2017,2017,★★★★★,mias eyes drift as she heads to the bar she recognizes the sign sebs the images on the wall and the stool sebastians formerly hoagy carmichaelsmia finds a seat with her husband as the combo finishes their set a large applause appearsand just then sebastian appears mia looks at himfrozen her heart beating faster as sebastian names the members of the band he looks at the crowd and sees miathe two lock eyes and you canmore
La La Land,letterboxd,"Just like a piece of nostalgic memorabilia,La La Landprovides a warm feeling but can never escape the fact that it is only an imitation. As a love letter to old Hollywood and the heyday of musicals,La La Landis a winning success but, unlike the musicals it imitates, there's no sense that it will remain a timeless classic. It's a whimsical and old school film that has obvious appeal to film fans, critics and creators as well as…more",08 Jan 2017,2017,★★★½,just like a piece of nostalgic memorabiliala la landprovides a warm feeling but can never escape the fact that it is only an imitation as a love letter to old hollywood and the heyday of musicalsla la landis a winning success but unlike the musicals it imitates theres no sense that it will remain a timeless classic its a whimsical and old school film that has obvious appeal to film fans critics and creators as well asmore
La La Land,letterboxd,"As beautiful as falling in love is so fragile, La La Land is a movie that's why I love so much. While watching Mia and Sebastian, I felt so much pain that they knew that they loved each other and still couldn't be together, I hold myself back because I wouldn't cry, but when Mia and Sebastian come face to face, something breaks inside me.The moment Mia and Sebastian's Theme is played, the strings break, the songs drag me…more",27 Aug 2023,2023,★★★★★,as beautiful as falling in love is so fragile la la land is a movie thats why i love so much while watching mia and sebastian i felt so much pain that they knew that they loved each other and still couldnt be together i hold myself back because i wouldnt cry but when mia and sebastian come face to face something breaks inside methe moment mia and sebastians theme is played the strings break the songs drag memore
La La Land,letterboxd,"дуэт эммы стоун и райана гослинга - лучшее, что было в современном кинематографеа так, проникнуться не вышло, к сожалению...можете считать меня бездушной мразью, но на меня чёт не сработало. и даже не смотря на то, что это мюзикл (тут всё идеально), а кадр со взглядами Мии и Себастьяна великолепен, да и в целом всё прям ОЧЕНЬ красиво, но в остальном, история не сработала от слова совсем...(",15 May 2025,2025,★★★,дуэт эммы стоун и райана гослинга лучшее что было в современном кинематографеа так проникнуться не вышло к сожалениюможете считать меня бездушной мразью но на меня чёт не сработало и даже не смотря на то что это мюзикл тут всё идеально а кадр со взглядами мии и себастьяна великолепен да и в целом всё прям очень красиво но в остальном история не сработала от слова совсем
La La Land,letterboxd,"“I’m always gonna love you.”“I’m always gonna love you, too.”Featured Lists:-My Favorite Films-A+ Rated MoviesThe phrase “show me, don’t tell me,” is usedall the timewhen talking about films. Such a simple thing, yet can be so impactful in a film. Especially in a certain type of film, such asLa La Land.When you take a concept likeInception,let’s just say, that’s a movie you’d need to betoldjust as much asshown.…more",14 Jun 2020,2020,★★★★★,im always gonna love youim always gonna love you toofeatured listsmy favorite filmsa rated moviesthe phrase show me dont tell me is usedall the timewhen talking about films such a simple thing yet can be so impactful in a film especially in a certain type of film such asla la landwhen you take a concept likeinceptionlets just say thats a movie youd need to betoldjust as much asshownmore
La La Land,letterboxd,"Maturing is realizing that La La Land is actually a happy endingIt is not about two people staying together forever, it is about two people meeting at the right time, changing each other's lives, and leaving with more than they came with. Mia became the woman she dreamed of because Seb believed in her, and Seb built the club he always wanted because Mia reminded him not to give up.Their love was not wasted. It was a bridge,…more",10 Feb 2026,2026,★★★★★,maturing is realizing that la la land is actually a happy endingit is not about two people staying together forever it is about two people meeting at the right time changing each others lives and leaving with more than they came with mia became the woman she dreamed of because seb believed in her and seb built the club he always wanted because mia reminded him not to give uptheir love was not wasted it was a bridgemore
La La Land,letterboxd,"Lowkey, its time to start calling people our la la land instead of roman empire. Have thought multiple times to wrote a long ass review and sharing my past experience but i cant and it'll stay in my notes app forever but theres this beautifull reel I saw the other day which kind of explains why I think la la land is perfect for me. You can check it outhere.",09 Dec 2025,2025,★★★★★,lowkey its time to start calling people our la la land instead of roman empire have thought multiple times to wrote a long ass review and sharing my past experience but i cant and itll stay in my notes app forever but theres this beautifull reel i saw the other day which kind of explains why i think la la land is perfect for me you can check it outhere
La La Land,letterboxd,"in the world of perfectionist(and wonderful) people,i am mia dolan",29 Mar 2025,2025,★★★★★,in the world of perfectionistand wonderful peoplei am mia dolan
La La Land,letterboxd,"Don't mind me, just back to rewatch one of my favorite films that happens to star2 time Academy Award winnerEmma Stone.",11 Mar 2024,2024,★★★★★,dont mind me just back to rewatch one of my favorite films that happens to star2 time academy award winneremma stone
La La Land,letterboxd,"for the fools who dream, and for the fools who, out of love, push one another to fulfill them, no matter the cost ❤️💔",18 Jan 2024,2024,★★★★★,for the fools who dream and for the fools who out of love push one another to fulfill them no matter the cost
La La Land,letterboxd,If I were able to tattoo the 129 minutes of this film I'd do it in a heartbeat.,25 Sep 2023,2023,★★★★★,if i were able to tattoo the 129 minutes of this film id do it in a heartbeat
La La Land,letterboxd,"""Here's to the ones who dream / Foolish as they may seem /Here's to the hearts that ache / Here's to the mess we make...""***La La LandisGREAT.But is it really 7 Golden Globes-winning ""GREAT""?Or, even more especially, is it really 14 -freakin' FOURTEEN!!- Oscar-nominations ""GREAT""?See, here's the thing:I'm afraid that all of this overwhelmingly monumental amount of hyperbolic hype and astounding acclaim is going to eventually negatively impact the…more",21 Jan 2017,2017,★★★★★,heres to the ones who dream foolish as they may seem heres to the hearts that ache heres to the mess we makela la landisgreatbut is it really 7 golden globeswinning greator even more especially is it really 14 freakin fourteen oscarnominations greatsee heres the thingim afraid that all of this overwhelmingly monumental amount of hyperbolic hype and astounding acclaim is going to eventually negatively impact themore
La La Land,letterboxd,finishing off my own bday celebrations by celebrating the best film ever made and my fave film evers bday xxxx,09 Dec 2024,2024,★★★★★,finishing off my own bday celebrations by celebrating the best film ever made and my fave film evers bday xxxx
La La Land,letterboxd,"I have no idea if I love this movie or not. It was great. I cried throughout the last half an hour of the film. Yeah, it was fun. I like Emma Stone better than Ryan Gosling. The songs were GOOD, but not as catchy asLes Demoiselles de Rochefortwhich is among my very favorites, so I'm biased. Being in L.A. for over 10 years now (I was born here, but moved elsewhere and then came back), I've lived…more",07 Jan 2017,2017,★★★★,i have no idea if i love this movie or not it was great i cried throughout the last half an hour of the film yeah it was fun i like emma stone better than ryan gosling the songs were good but not as catchy asles demoiselles de rochefortwhich is among my very favorites so im biased being in la for over 10 years now i was born here but moved elsewhere and then came back ive livedmore
La La Land,letterboxd,"will i ever stop getting chills during the opening and closing numbers? my hot take onla la land:inumbrellas of cherbourgthat chazelle obviously took a lot of inspiration from, the characters both end up married and with a child whereas here, that only applies to mia. and while it is possible that we simply don’t see sebastian’s family that doesn’t really add up to me lol. clearly i still love this movie i just thought this was interesting to note and maybe to ponder on? anyway hope everybody has (had) a good day, whether they celebrate valentine’s day or not:]",14 Feb 2026,2026,★★★★★,will i ever stop getting chills during the opening and closing numbers my hot take onla la landinumbrellas of cherbourgthat chazelle obviously took a lot of inspiration from the characters both end up married and with a child whereas here that only applies to mia and while it is possible that we simply dont see sebastians family that doesnt really add up to me lol clearly i still love this movie i just thought this was interesting to note and maybe to ponder on anyway hope everybody has had a good day whether they celebrate valentines day or not
La La Land,letterboxd,"""I'll still love you!"".Well, this movie has a really nice amount of emotions.I'm not a fan of romance movies a lot, but that changed my view of them.I watched this movie just after I woke up todayI was supposed to watch it yesterday after the testBy the way, I had a college test, and I got my full grade. This movie is my award.I'm so happy now.",02 Dec 2025,2025,★★★★½,ill still love youwell this movie has a really nice amount of emotionsim not a fan of romance movies a lot but that changed my view of themi watched this movie just after i woke up todayi was supposed to watch it yesterday after the testby the way i had a college test and i got my full grade this movie is my awardim so happy now
La La Land,letterboxd,"noone speak to me rn, its 2am and i need to recover from this movie.",30 Jun 2025,2025,★★★★,noone speak to me rn its 2am and i need to recover from this movie
La La Land,letterboxd,who’s gonna tell stupid keith his stupid band was only successful bc of the absolute worldie on the keys. look at everyone shoving mia out of the way just to catch a glimpse of him.,16 Sep 2024,2024,★★★★★,whos gonna tell stupid keith his stupid band was only successful bc of the absolute worldie on the keys look at everyone shoving mia out of the way just to catch a glimpse of him
La La Land,letterboxd,Best movie of all time. I love you so much.This week’s Patreon episode:La La Land,20 Aug 2024,2024,★★★★★,best movie of all time i love you so muchthis weeks patreon episodela la land
La La Land,letterboxd,i go back to this movie the way people go back to their ex’s knowing they’ll only make them cry,10 May 2024,2024,★★★★★,i go back to this movie the way people go back to their exs knowing theyll only make them cry
La La Land,letterboxd,"just discovered damien chazelle’s first pitch for la la land and thought i’d share it here:""It involved a jail break and a prison sort of the thing, and the main character was an autistic suicidal depressive. But somehow they went into a planetarium and flew up into space.”",27 Feb 2024,2024,★★★★★,just discovered damien chazelles first pitch for la la land and thought id share it hereit involved a jail break and a prison sort of the thing and the main character was an autistic suicidal depressive but somehow they went into a planetarium and flew up into space
La La Land,letterboxd,argument scene is my roman empire,28 Dec 2023,2023,★★★★★,argument scene is my roman empire
La La Land,letterboxd,"gaslight, gatekeep, goslingup in the skies, the intangible presence of jacques demy smiles down on this films existence!!!!the more and more i watch this, the more and more less composed and stupid i think these reviews are going to become",01 Jun 2021,2021,★★★★★,gaslight gatekeep goslingup in the skies the intangible presence of jacques demy smiles down on this films existencethe more and more i watch this the more and more less composed and stupid i think these reviews are going to become
