movie,platform,review_text,date,year,rating,clean_text
La La Land,letterboxd,What is the greatest movie ever?• A: La La Land          • B: La La Land• C: La La Land          • D: La La Land,05 Sep 2019,2019,★★★★★,what is the greatest movie ever a la la land           b la la land c la la land           d la la land
La La Land,letterboxd,"Paramparcayim suandaNereden baslasam bilemiyorum ama kesinlikle bu kadar mukemmel bir sey beklemiyordum. Normalde Muzikal severim tabi ama genel olarak izlerken sıkıldıgım bir film turuydu ama bu..La la land bambaska bir deneyimdi benim icin.Filmin renk paletinin, sahnelerin hissettirmesi gereken duygulara gore sekil almasi beni fazlasiyla etkiledi.Muzikleri zaten muazzam bir sey. Nasıl anlatsam ne desem bilemiyorum. Sebastian’in piano calarken bastigi her notada o huzunle karisik coskuyu, heyecani iliklerime kadar hissettim resmen. Filmdeki muzik bana yeni baslangiclar ve yasanan…more",27 Jan 2026,2026,★★★★★,paramparcayim suandanereden baslasam bilemiyorum ama kesinlikle bu kadar mukemmel bir sey beklemiyordum normalde muzikal severim tabi ama genel olarak izlerken sıkıldıgım bir film turuydu ama bula la land bambaska bir deneyimdi benim icinfilmin renk paletinin sahnelerin hissettirmesi gereken duygulara gore sekil almasi beni fazlasiyla etkiledimuzikleri zaten muazzam bir sey nasıl anlatsam ne desem bilemiyorum sebastianin piano calarken bastigi her notada o huzunle karisik coskuyu heyecani iliklerime kadar hissettim resmen filmdeki muzik bana yeni baslangiclar ve yasananmore
La La Land,letterboxd,⠀⠀⠀⠀⠀⠀⠀⠀« and here's to the fools who dream⠀⠀⠀⠀⠀⠀⠀⊹˚. ⟡  crazy as they may seem ‎‧‎ ˖˚⋆𖥔⠀⠀⠀⠀⠀⠀⠀‎˖˚⊹ here's to the hearts that break ⋆˚⠀⠀⠀⠀⠀⠀⠀⊹ ࣪ ˖ 𖥔 here's to the mess we make. »⠀,02 Feb 2024,2024,★★★★½,and heres to the fools who dream  crazy as they may seem 𖥔 heres to the hearts that break 𖥔 heres to the mess we make
La La Land,letterboxd,First watch of 2021 so I can start the new year with ✨ colourful depression ✨,01 Jan 2021,2021,★★★★★,first watch of 2021 so i can start the new year with colourful depression
La La Land,letterboxd,"100-word review: A colourful, dreamy throwback to old-school Hollywood musicals that’s easy to get swept up in, at least some of the time. Sometimes you can’t have both love and ambition, and chasing your dream might mean losing something else along the way — it's a message with staying power. The jazz storyline, while central, comes off as preachy however, with Gosling’s character reduced to a stubborn caricature; we get it Damien Chazelle, you like jazz... The song-and-dance sequences vary from good to serviceable, but don't really wow me overall. Then again, I'm just not much of a musical enthusiast to begin with.",07 Sep 2025,2025,★★★,100word review a colourful dreamy throwback to oldschool hollywood musicals thats easy to get swept up in at least some of the time sometimes you cant have both love and ambition and chasing your dream might mean losing something else along the way its a message with staying power the jazz storyline while central comes off as preachy however with goslings character reduced to a stubborn caricature we get it damien chazelle you like jazz the songanddance sequences vary from good to serviceable but dont really wow me overall then again im just not much of a musical enthusiast to begin with
La La Land,letterboxd,"eu achando que ia ter um final feliz, e recebi um talvez em outra vida.",19 Jul 2025,2025,★★★★★,eu achando que ia ter um final feliz e recebi um talvez em outra vida
La La Land,letterboxd,Having this in my four favorites makes it more efficient when I log my constant rewatches.,12 Jan 2024,2024,★★★★★,having this in my four favorites makes it more efficient when i log my constant rewatches
La La Land,letterboxd,"I’m not into musicals at all and that’s why I avoided this film for so long but I guess La La Land is the exception for me. What a beautiful story.Props to Damien Chazelle, this is a masterpiece in filmmaking, from the color schemes to the camera work. Also worth mentioning the amazing performances from Ryan Gosling and Emma Stone who shared impressive chemistry. As heartbreaking as the ending is, it was perfect.",03 Sep 2023,2023,★★★★½,im not into musicals at all and thats why i avoided this film for so long but i guess la la land is the exception for me what a beautiful storyprops to damien chazelle this is a masterpiece in filmmaking from the color schemes to the camera work also worth mentioning the amazing performances from ryan gosling and emma stone who shared impressive chemistry as heartbreaking as the ending is it was perfect
La La Land,letterboxd,"One of the thirty greatest films ever made, and I have no bones in making that kind of tall declaration. You can say you had a good time with “West Side Story,” “My Fair Lady” and “Chicago” without feeling you ever had to see them a second time.La La Landis the greatest commercial musical of the last 63 years (since 1953’s “The Band Wagon”), made with dazzling numbers, verbal wit that’s terse and not overwritten, charisma by jazz…more",05 Aug 2019,2019,★★★★★,one of the thirty greatest films ever made and i have no bones in making that kind of tall declaration you can say you had a good time with west side story my fair lady and chicago without feeling you ever had to see them a second timela la landis the greatest commercial musical of the last 63 years since 1953s the band wagon made with dazzling numbers verbal wit thats terse and not overwritten charisma by jazzmore
La La Land,letterboxd,"La La Land is a stylish and self aware musical that explores the cost of pursuing your dreams, and the lies and artifice we surround ourselves with.Damien Chazelle knocks it out of the park again showing he's a director to keep an eye on. I think he will delight us for years to come.",06 Nov 2016,2016,★★★★½,la la land is a stylish and self aware musical that explores the cost of pursuing your dreams and the lies and artifice we surround ourselves withdamien chazelle knocks it out of the park again showing hes a director to keep an eye on i think he will delight us for years to come
La La Land,letterboxd,"Ahhhhh, what a beauty..The opening scene did have me slightly worried but as soon as we get our leads on screen, it was onlyupfrom there.Emma StoneandRyan Goslingare bothamazinghere. I loved their characters and the dialog shared. The musical set pieces wereawesometoo. I also loveJazzmusic, which I got my uncle to thank for that since he brought me to a few Jazz concerts when I was younger. Plus how…more",17 Jun 2022,2022,★★★★½,ahhhhh what a beautythe opening scene did have me slightly worried but as soon as we get our leads on screen it was onlyupfrom thereemma stoneandryan goslingare bothamazinghere i loved their characters and the dialog shared the musical set pieces wereawesometoo i also lovejazzmusic which i got my uncle to thank for that since he brought me to a few jazz concerts when i was younger plus howmore
La La Land,letterboxd,I cant talk about this movie without tearing uptop 10 endings oat,17 Feb 2026,2026,★★★★★,i cant talk about this movie without tearing uptop 10 endings oat
La La Land,letterboxd,"Seriously, the best movie I ever watched. You know it’s a good one when you can feel a whiff of that LA early morning breeze through the screen.My rewatch this time was through a different approach. This morning, I decided to download Damien Chazelle’s La La Land Screenplay on my phone as I was walking on the treadmill (weird way to read, but I always read on the treadmill, strangely so). Reading that screenplay, you know Chazelle wasn't enamored…more",14 Feb 2026,2026,★★★★★,seriously the best movie i ever watched you know its a good one when you can feel a whiff of that la early morning breeze through the screenmy rewatch this time was through a different approach this morning i decided to download damien chazelles la la land screenplay on my phone as i was walking on the treadmill weird way to read but i always read on the treadmill strangely so reading that screenplay you know chazelle wasnt enamoredmore
La La Land,letterboxd,"*live in concert*Justin Hurtitz conducted the ""live in concert""; it was the best experience I've had with the film since I first watched it in theaters. What a pleasant surprise! The live orchestra had me in goosebumps most of the time. 1000/10 recommend. It's the best movie ever.",09 Apr 2025,2025,★★★★★,live in concertjustin hurtitz conducted the live in concert it was the best experience ive had with the film since i first watched it in theaters what a pleasant surprise the live orchestra had me in goosebumps most of the time 100010 recommend its the best movie ever
La La Land,letterboxd,no matter how many times I see this movie I always cry so much,03 Sep 2024,2024,★★★★★,no matter how many times i see this movie i always cry so much
La La Land,letterboxd,"the thing in this movie is that it is so realistic. struggles. dreams. first impressions. relationships. the ending is so real and it really focuses on nowadays’ society and what usually happens with a couple. that’s life. you not only get the whole package and sacrifices are made. also, their singing makes it even more perfect to the audience’s ears, no playback or unrealistically voices, just them singing while filming and their raw emotions. i have watched this so many times over the last years and it still touches me deeply, i am still moved. my favorite movie ever.",26 May 2024,2024,★★★★★,the thing in this movie is that it is so realistic struggles dreams first impressions relationships the ending is so real and it really focuses on nowadays society and what usually happens with a couple thats life you not only get the whole package and sacrifices are made also their singing makes it even more perfect to the audiences ears no playback or unrealistically voices just them singing while filming and their raw emotions i have watched this so many times over the last years and it still touches me deeply i am still moved my favorite movie ever
La La Land,letterboxd,i hope sebastian wilder and mia dolan are having a good day,13 Sep 2018,2018,★★★★★,i hope sebastian wilder and mia dolan are having a good day
La La Land,letterboxd,"My mother asked if I thought it was corny. ""But I thought it was corny too, and I can still love it!"" she said defensively before I could answer yes or no. I didn't think it was corny, actually, it's actually deeply cynical and that's one of the only things I like about La La Land. Singin' in the Rain is corny. La La Land? It's smug. Worse: it's smug AND it has little reason to beChrist, I was…more",8 Jan 2017,2017,★,my mother asked if i thought it was corny but i thought it was corny too and i can still love it she said defensively before i could answer yes or no i didnt think it was corny actually its actually deeply cynical and thats one of the only things i like about la la land singin in the rain is corny la la land its smug worse its smug and it has little reason to bechrist i wasmore
La La Land,letterboxd,i’ll never be normal about this like…it’s the best ever,07 Dec 2023,2023,★★★★★,ill never be normal about this likeits the best ever
La La Land,letterboxd,"It's crazy how opinions changes over time. I remember the first time I watched this movie and hated it. Than 2 1/2 years later I watched it again just because and fell in love with it. The songs, dance, costumes, and I just love everything about La La Land.10 reviews today so please go read them ThAnK YoU :)",07 Jun 2020,2020,★★★★★,its crazy how opinions changes over time i remember the first time i watched this movie and hated it than 2 12 years later i watched it again just because and fell in love with it the songs dance costumes and i just love everything about la la land10 reviews today so please go read them thank you
La La Land,letterboxd,Thank you Damien Chazelle because I can’t imagine a world without La La Land.,17 Aug 2024,2024,★★★★½,thank you damien chazelle because i cant imagine a world without la la land
La La Land,letterboxd,watching my favorite movie on my birthday was truly magical,14 Aug 2024,2024,★★★★★,watching my favorite movie on my birthday was truly magical
La La Land,letterboxd,"MIA DOLAN, YOU ARE A TWO-TIME OSCAR WINNER",10 Mar 2024,2024,★★★★★,mia dolan you are a twotime oscar winner
La La Land,letterboxd,How come Mia and Sebastian are so bad with remembering dates and scheduling things? Are they stupid?,13 Sep 2023,2023,★★★★,how come mia and sebastian are so bad with remembering dates and scheduling things are they stupid
La La Land,letterboxd,im NEVER going to LA cuz if there wasn’t a tint of purple around the entire city i’d be so disappointed,05 Jul 2023,2023,★★★★½,im never going to la cuz if there wasnt a tint of purple around the entire city id be so disappointed
La La Land,letterboxd,my brain for 128 minutes:👀👌👀👌👀👌👀 good shit go౦ԁ sHit👌 thats ✔ some good👌👌shit right👌👌there👌👌👌 right✔there ✔✔if i do ƽaү so my self 💯 i say so 💯 thats what im talking about right there right there (chorus: ʳᶦᵍʰᵗ ᵗʰᵉʳᵉ) mMMMMᎷМНO0ОଠOOOOOОଠଠOoooᵒᵒᵒᵒᵒᵒᵒᵒᵒ👌 👌👌 👌 💯 👌 👀 👀 👀 👌👌Good shit,15 Jul 2018,2018,★★★★★,my brain for 128 minutes good shit go౦ԁ shit thats some goodshit rightthere rightthere if i do ƽaү so my self i say so thats what im talking about right there right there chorus ʳᶦᵍʰᵗ ᵗʰᵉʳᵉ mmmmmꮇмнo0оଠoooooоଠଠooooᵒᵒᵒᵒᵒᵒᵒᵒᵒ good shit
La La Land,letterboxd,A white Canadian keyboard player dreams of saving jazz music by opening a fried-chicken restaurant.,4 Jan 2017,2017,★★½,a white canadian keyboard player dreams of saving jazz music by opening a friedchicken restaurant
La La Land,letterboxd,"People be saying the want to live in barbie, I want to live in this extravagant, extraordinary, unbelievable film. Truly probably would never be able to describe feelings for this.",02 Oct 2024,2024,★★★★★,people be saying the want to live in barbie i want to live in this extravagant extraordinary unbelievable film truly probably would never be able to describe feelings for this
La La Land,letterboxd,"seb: i'm always gonna love you.mia: i'm always gonna love you, too.me, a mess, screaming and bawling my heart out: I HATE THIS FILM*** longer review ahead ***my heart is still stuck in my chest and here are reasons why:✤ ryan gosling's long pause before the line""welcome to seb's.""letting mia know she IS welcome! he knew she would eventually walk in there, the jazz club of his dreams, and this was him saying he owed…more",20 Apr 2024,2024,★★★★,seb im always gonna love youmia im always gonna love you toome a mess screaming and bawling my heart out i hate this film longer review ahead my heart is still stuck in my chest and here are reasons why ryan goslings long pause before the linewelcome to sebsletting mia know she is welcome he knew she would eventually walk in there the jazz club of his dreams and this was him saying he owedmore
La La Land,letterboxd,this movie is breathtaking im physically ill,11 Nov 2022,2022,★★★★★,this movie is breathtaking im physically ill
La La Land,letterboxd,'i'll admit i was a little curt that night',21 Mar 2019,2019,★★★★★,ill admit i was a little curt that night
La La Land,letterboxd,I am so jealous Damien Chazelle got to make this instead of me...,19 Dec 2016,2016,★★★★★,i am so jealous damien chazelle got to make this instead of me
La La Land,letterboxd,- thank you for 2000 followers i very much appreciate it and i’m so grateful 🩵- SPOLIERS!!- recommended byW🫐──────────────────- guys are the sunsets real?! they’re just so beautiful and fit every scene perfectly- i already knew mia was my favourite character when she flipped off sebastian- she deserved that first role.- tap dancing was so satisfying especially with that sky- i wanna watch old movies with emma stone- idk why but…more,14 Aug 2025,2025,★★★★★,thank you for 2000 followers i very much appreciate it and im so grateful spoliers recommended byw guys are the sunsets real theyre just so beautiful and fit every scene perfectly i already knew mia was my favourite character when she flipped off sebastian she deserved that first role tap dancing was so satisfying especially with that sky i wanna watch old movies with emma stone idk why butmore
La La Land,letterboxd,"I watched this film again after almost 10 years.Over the years, I had forgotten how much I used to love it.Watching it brought back a wave of nostalgia — it made me sad, remembering all the good things.",17 Jun 2025,2025,★★★★★,i watched this film again after almost 10 yearsover the years i had forgotten how much i used to love itwatching it brought back a wave of nostalgia it made me sad remembering all the good things
La La Land,letterboxd,and at the end of the day this is still my movie.,17 May 2024,2024,★★★★★,and at the end of the day this is still my movie
La La Land,letterboxd,Try not to cry during the Epilogue challenge (Impossible) (Failed),06 Jan 2024,2024,★★★★★,try not to cry during the epilogue challenge impossible failed
La La Land,letterboxd,"Okay, I know the last thing everyone needs is yet another review of this brush fire.It's a 4 star film with some 5 star moments.It's pretty great but everyone just calm down already.I will just add that this film hit close to home with a few points and felt as if Chazelle had not only thrust a knife into me, but then twisted it. I cannot say that when I view this film under different circumstances whether it will lower or raise my opinion of it. The craft is all there however.",14 Jan 2017,2017,★★★★,okay i know the last thing everyone needs is yet another review of this brush fireits a 4 star film with some 5 star momentsits pretty great but everyone just calm down alreadyi will just add that this film hit close to home with a few points and felt as if chazelle had not only thrust a knife into me but then twisted it i cannot say that when i view this film under different circumstances whether it will lower or raise my opinion of it the craft is all there however
La La Land,letterboxd,starting spooky season with the scariest horror film out there 🎃🕸️👻,01 Oct 2025,2025,★★★★★,starting spooky season with the scariest horror film out there
La La Land,letterboxd,"i will always love youi want someone to believe in my dreams like they believed in each other's. maybe i'll finally be motivated if someone who's not obligated to love me, loves mefor me and my dreams",11 Jul 2025,2025,★★★★,i will always love youi want someone to believe in my dreams like they believed in each others maybe ill finally be motivated if someone whos not obligated to love me loves mefor me and my dreams
La La Land,letterboxd,"Welp, now im sad AND single on Valentines Day, truly thriving. Oh well,Fantasticmovie though.Happy Valentines day to you all! Decided to revisit one of the greatest modern romance films thats quickly becoming a favourite.La La Landis a visual feast, with incredible cinematography and vivid use of colours that make for this encapsulating vibe. Really one of those “every frame a painting” type of movies likeBarry LyndonorLord of the Rings,where almost every shot looks like…more",14 Feb 2025,2025,★★★★★,welp now im sad and single on valentines day truly thriving oh wellfantasticmovie thoughhappy valentines day to you all decided to revisit one of the greatest modern romance films thats quickly becoming a favouritela la landis a visual feast with incredible cinematography and vivid use of colours that make for this encapsulating vibe really one of those every frame a painting type of movies likebarry lyndonorlord of the ringswhere almost every shot looks likemore
La La Land,letterboxd,“who knows? i felt it from the first embrace i shared with youthat now our dreams may finally come true”it doesn’t get much better than this! i don’t think i’ll ever love any other piece of art as much as i love this movie. life never feels quite the same after experiencingit all over again — all the colors are brighter somehow. they’ve been getting brighter and brighter ever since i saw it for the first time. and i’ll never get enough!!!,12 Jul 2024,2024,★★★★★,who knows i felt it from the first embrace i shared with youthat now our dreams may finally come trueit doesnt get much better than this i dont think ill ever love any other piece of art as much as i love this movie life never feels quite the same after experiencingit all over again all the colors are brighter somehow theyve been getting brighter and brighter ever since i saw it for the first time and ill never get enough
La La Land,letterboxd,"Day five of watching one movie a day picked by youSuggested by duncancovertOh boy, five days in and already a close call but anyway yeah the ending still breaks me and I still love the shots and Ryan Gosling and hot take prefer it over Whiplash but Then again two very different movies and that answer changes every day.",09 Jan 2024,2024,★★★★½,day five of watching one movie a day picked by yousuggested by duncancovertoh boy five days in and already a close call but anyway yeah the ending still breaks me and i still love the shots and ryan gosling and hot take prefer it over whiplash but then again two very different movies and that answer changes every day
La La Land,letterboxd,I could delve deep into the darkness and talk about how utterly disgraceful it was that the bitch next to me got their PHONE OUT and started to USE IT to BROWSE THEIR APPS during A LOVELY GODDAMN NIGHT (yes I snapped at them they fucking caught these fists) but honestly... it's hard to stay mad when there's so much beauty in the world :'),10 Jan 2017,2017,★★★★★,i could delve deep into the darkness and talk about how utterly disgraceful it was that the bitch next to me got their phone out and started to use it to browse their apps during a lovely goddamn night yes i snapped at them they fucking caught these fists but honestly its hard to stay mad when theres so much beauty in the world
La La Land,letterboxd,"""Given the middle-child syndrome of whether musicals can exist in today's film landscape,La La Landfeels obsessed in its construction that it alone can save the genre. But perfection has a price, andLa La Land's constant swooning and 'look at me!' attitude is downright exhausting. It's the cinematic equivalent of being friends with Anne Hathaway.""MyLAistreview of the throwback musical(my favorite genre), and another case of a well-loved movie I just really didn't take to.",05 Dec 2016,2016,★★½,given the middlechild syndrome of whether musicals can exist in todays film landscapela la landfeels obsessed in its construction that it alone can save the genre but perfection has a price andla la lands constant swooning and look at me attitude is downright exhausting its the cinematic equivalent of being friends with anne hathawaymylaistreview of the throwback musicalmy favorite genre and another case of a wellloved movie i just really didnt take to
La La Land,letterboxd,call me by your lalaland,22 Feb 2026,2026,★★★★★,call me by your lalaland
La La Land,letterboxd,"If I never watch La La Land again, it'll be because of J.K. Simmons. Just seeing him in a room with jazz playing gives me PTSD",21 Jul 2025,2025,★★★★★,if i never watch la la land again itll be because of jk simmons just seeing him in a room with jazz playing gives me ptsd
La La Land,letterboxd,"this was perfect, and I’ll always think about how my mild road rage will lead to love :,)",15 Aug 2023,2023,★★★★★,this was perfect and ill always think about how my mild road rage will lead to love
La La Land,letterboxd,the epilogue will always be real to me,01 May 2022,2022,★★★★★,the epilogue will always be real to me
La La Land,letterboxd,I think this might be a Christmas movie by what I’ve noticed during the restaurant scene when Ryan Gosling was playingDeck The Hallson a piano.You can really agree or disagree with me about it.,25 Dec 2024,2024,★★★★★,i think this might be a christmas movie by what ive noticed during the restaurant scene when ryan gosling was playingdeck the hallson a pianoyou can really agree or disagree with me about it
La La Land,letterboxd,love a person that talks about you with the same passion that sebastian talks about jazz,15 Jun 2024,2024,★★★★★,love a person that talks about you with the same passion that sebastian talks about jazz
